### ISSUE TITLE
Problemas arranque geth nodo Amtega

### ISSUE THREAD

**Issue by sistemasamtega** [alastria/alastria-node#817]
No consigue arrancar completamente el proceso geth desde aproximadamente las 13:50.  No se está proporcionando servicio.

Es un Ubuntu SMP con kernel 4.4.0-161-generic.
Nodo regular standalone REG_AMTEGA_Telsius_4_8_00.
La máquina tiene una CPU de 4 cores a 2.1GHz.

El programa geth arrancado mediante /data/alastria-node/scripts/start.sh usa la CPU al 100% (un core).
```
root@prd-blockchain-0001:~# ps aux|grep geth
blockch+   1972  100  9.0 2526308 1489192 ?     Sl   16:25 123:56 geth --datadir /data/alastria/data --networkid 83584648538 --identity REG_AMTEGA_Telsius_4_8_00 --permissioned --rpcvhosts=prd-blockchain-0001.xunta.local --rpc --rpcaddr 0.0.0.0 --rpcapi admin,db,eth,debug,miner,net,shh,txpool,personal,web3,quorum,istanbul --rpcport 22000 --port 21000 --cache 1024 --istanbul.requesttimeout 10000 --ethstats REG_AMTEGA_Telsius_4_8_00:bb98a0b6442386d0cdf8a31b267892c1@netstats.telsius.alastria.io:80 --verbosity 3 --vmdebug --emitcheckpoints --targetgaslimit 8000000 --syncmode full --gcmode full --vmodule consensus/istanbul/core/core.go=5 --nodiscover
root       6795  0.0  0.0  14160  1088 pts/0    S+   18:28   0:00 grep --color=auto geth
root@prd-blockchain-0001:~# free -h
              total        used        free      shared  buff/cache   available
Mem:            15G        1,6G         12G        8,9M        1,5G         13G
Swap:          1,9G          0B        1,9G

```

```
blockchain@prd-blockchain-0001:~/alastria/logs$ geth version
Geth
Version: 1.8.18-stable
Quorum Version: 2.2.3-0.Alastria_EthNetstats_IBFT
Architecture: amd64
Protocol Versions: [63 62]
Network Id: 1337
Go Version: go1.9.5
Operating System: linux
GOPATH=
GOROOT=/usr/local/go
```

El último log en el que funcionaba correctamente es quorum_20201231031401.log, que termina con
```
INFO [01-11|13:50:48.243] QUORUM-CHECKPOINT                        name=TX-CREATED tx=0x867c9a996af625d8a3f024cfc8b6b2165de9cb4534b11c54d9bae34c2273c52d to=0x96cF0Bc9045707164A025eb6bfF69AE6C92DFF65
INFO [01-11|13:50:49.431] Submitted transaction                    fullhash=0xa6740db69ba650f9fc09141a3cfc2ca9664aad31d29e9b061276f6e535138fac recipient=0x96cF0Bc9045707164A025eb6bfF69AE6C92DFF65
INFO [01-11|13:50:49.432] QUORUM-CHECKPOINT                        name=TX-CREATED tx=0xa6740db69ba650f9fc09141a3cfc2ca9664aad31d29e9b061276f6e535138fac to=0x96cF0Bc9045707164A025eb6bfF69AE6C92DFF65
INFO [01-11|13:50:51.243] Submitted transaction                    fullhash=0x1e4243a86343e45806177d582ef902d50b4f375e594d5521626b3cdc1c278002 recipient=0x96cF0Bc9045707164A025eb6bfF69AE6C92DFF65
INFO [01-11|13:50:51.243] QUORUM-CHECKPOINT                        name=TX-CREATED tx=0x1e4243a86343e45806177d582ef902d50b4f375e594d5521626b3cdc1c278002 to=0x96cF0Bc9045707164A025eb6bfF69AE6C92DFF65
INFO [01-11|13:50:52.350] Submitted transaction                    fullhash=0x3b4c7cbfd01bbccb6ac8a994a7ee3753be4b8f1e21e6e012354b84a93d612edd recipient=0x96cF0Bc9045707164A025eb6bfF69AE6C92DFF65
INFO [01-11|13:50:52.350] QUORUM-CHECKPOINT                        name=TX-CREATED tx=0x3b4c7cbfd01bbccb6ac8a994a7ee3753be4b8f1e21e6e012354b84a93d612edd to=0x96cF0Bc9045707164A025eb6bfF69AE6C92DFF65
fatal error: runtime: out of memory

runtime stack:

```

En el resto de logs se ve que no consigue arrancar, en el caso actual tras un reboot y 2 horas desde el arranque del proceso geth.

quorum_20210111135202.log
```
INFO [01-11|13:52:02.561] Maximum peer count                       ETH=25 LES=0 total=25
INFO [01-11|13:52:02.577] Starting peer-to-peer node               instance=Geth/REG_AMTEGA_Telsius_4_8_00/v1.8.18-stable(quorum-v2.2.3-0.Alastria_EthNetstats_IBFT)/linux-amd64/go1.9.5
INFO [01-11|13:52:02.578] Allocated cache and file handles         database=/data/alastria/data/geth/chaindata cache=768 handles=524288
INFO [01-11|13:52:06.936] Initialised chain configuration          config="{ChainID: 83584648538 Homestead: 0 DAO: <nil> DAOSupport: false EIP150: 0 EIP155: 0 EIP158: 0 Byzantium: 0 IsQuorum: true Constantinople: <nil> Engine: istanbul}"
INFO [01-11|13:52:06.941] Initialising Ethereum protocol           versions="[63 62]" network=83584648538
WARN [01-11|13:52:06.954] Head state missing, repairing chain      number=59347303 hash=89bcf7…0d6b54
INFO [01-11|13:53:38.144] Rewound blockchain to past state         number=58781148 hash=0e9ae0…1a74d6
INFO [01-11|13:53:38.145] Loaded most recent local header          number=59347303 hash=89bcf7…0d6b54 td=59347304 age=3m29s
INFO [01-11|13:53:38.145] Loaded most recent local full block      number=58781148 hash=0e9ae0…1a74d6 td=58781149 age=6d20h22m
INFO [01-11|13:53:38.145] Loaded most recent local fast block      number=59347303 hash=89bcf7…0d6b54 td=59347304 age=3m29s
INFO [01-11|13:53:38.168] Setting new local account                address=0x66FE48b818d042b4AA51db3Ec9F06Ad32Da966a6
INFO [01-11|13:53:38.174] Setting new local account                address=0x96cF0Bc9045707164A025eb6bfF69AE6C92DFF65

```

quorum_20210111151101.log
```
INFO [01-11|15:11:01.578] Maximum peer count                       ETH=25 LES=0 total=25
INFO [01-11|15:11:01.580] Starting peer-to-peer node               instance=Geth/REG_AMTEGA_Telsius_4_8_00/v1.8.18-stable(quorum-v2.2.3-0.Alastria_EthNetstats_IBFT)/linux-amd64/go1.9.5
INFO [01-11|15:11:01.580] Allocated cache and file handles         database=/data/alastria/data/geth/chaindata cache=768 handles=524288
INFO [01-11|15:11:01.960] Initialised chain configuration          config="{ChainID: 83584648538 Homestead: 0 DAO: <nil> DAOSupport: false EIP150: 0 EIP155: 0 EIP158: 0 Byzantium: 0 IsQuorum: true Constantinople: <nil> Engine: istanbul}"
INFO [01-11|15:11:01.961] Initialising Ethereum protocol           versions="[63 62]" network=83584648538
WARN [01-11|15:11:01.962] Head state missing, repairing chain      number=59347303 hash=89bcf7…0d6b54
INFO [01-11|15:11:57.569] Rewound blockchain to past state         number=58781148 hash=0e9ae0…1a74d6
INFO [01-11|15:11:57.570] Loaded most recent local header          number=59347303 hash=89bcf7…0d6b54 td=59347304 age=1h21m48s
INFO [01-11|15:11:57.570] Loaded most recent local full block      number=58781148 hash=0e9ae0…1a74d6 td=58781149 age=6d21h40m
INFO [01-11|15:11:57.570] Loaded most recent local fast block      number=59347303 hash=89bcf7…0d6b54 td=59347304 age=1h21m48s
INFO [01-11|15:11:57.575] Setting new local account                address=0x66FE48b818d042b4AA51db3Ec9F06Ad32Da966a6
INFO [01-11|15:11:57.575] Setting new local account                address=0x96cF0Bc9045707164A025eb6bfF69AE6C92DFF65
```

quorum_20210111162508.log

```
INFO [01-11|16:25:08.441] Maximum peer count                       ETH=25 LES=0 total=25
INFO [01-11|16:25:08.448] Starting peer-to-peer node               instance=Geth/REG_AMTEGA_Telsius_4_8_00/v1.8.18-stable(quorum-v2.2.3-0.Alastria_EthNetstats_IBFT)/linux-amd64/go1.9.5
INFO [01-11|16:25:08.450] Allocated cache and file handles         database=/data/alastria/data/geth/chaindata cache=768 handles=524288
INFO [01-11|16:25:09.412] Initialised chain configuration          config="{ChainID: 83584648538 Homestead: 0 DAO: <nil> DAOSupport: false EIP150: 0 EIP155: 0 EIP158: 0 Byzantium: 0 IsQuorum: true Constantinople: <nil> Engine: istanbul}"
INFO [01-11|16:25:09.423] Initialising Ethereum protocol           versions="[63 62]" network=83584648538
WARN [01-11|16:25:09.448] Head state missing, repairing chain      number=59347303 hash=89bcf7…0d6b54
INFO [01-11|16:26:27.182] Rewound blockchain to past state         number=58781148 hash=0e9ae0…1a74d6
INFO [01-11|16:26:27.185] Loaded most recent local header          number=59347303 hash=89bcf7…0d6b54 td=59347304 age=2h36m18s
INFO [01-11|16:26:27.185] Loaded most recent local full block      number=58781148 hash=0e9ae0…1a74d6 td=58781149 age=6d22h55m
INFO [01-11|16:26:27.185] Loaded most recent local fast block      number=59347303 hash=89bcf7…0d6b54 td=59347304 age=2h36m18s
INFO [01-11|16:26:27.200] Setting new local account                address=0x66FE48b818d042b4AA51db3Ec9F06Ad32Da966a6
INFO [01-11|16:26:27.202] Setting new local account                address=0x96cF0Bc9045707164A025eb6bfF69AE6C92DFF65

```

Previamente al reboot había estos procesos bee:
```
root@prd-blockchain-0001:/data/alastria/logs# ps aux|grep bee|grep -v grep
blockch+   2023  0.0  0.0 202812   196 ?        Sl    2020   0:01 bee run -vendor=true -downdoc=true -gendoc=true
blockch+   5787  0.0  0.0 202812   812 ?        Sl    2020   0:01 bee run -vendor=true -downdoc=true -gendoc=true
blockch+   8879  0.0  0.0 266940   872 ?        Sl    2020   0:01 bee run -vendor=true -downdoc=true -gendoc=true
blockch+  11757  0.0  0.0 201404  1008 ?        Sl    2020   0:01 bee run -vendor=true -downdoc=true -gendoc=true
blockch+  13739  0.0  0.0 202812   612 ?        Sl    2020   0:01 bee run -vendor=true -downdoc=true -gendoc=true
blockch+  15497  0.0  0.0 202812   600 ?        Sl    2020   0:01 bee run -vendor=true -downdoc=true -gendoc=true
blockch+  17256  0.0  0.0 202812   996 ?        Sl    2020   0:01 bee run -vendor=true -downdoc=true -gendoc=true
blockch+  19096  0.0  0.0 134812   212 ?        Sl    2020   0:00 bee run -vendor=true -downdoc=true -gendoc=true
blockch+  20867  0.0  0.0 137276  1076 ?        Sl    2020   0:00 bee run -vendor=true -downdoc=true -gendoc=true
blockch+  22633  0.0  0.0 209600   840 ?        Sl    2020   0:00 bee run -vendor=true -downdoc=true -gendoc=true
blockch+  24473  0.0  0.0 202812   792 ?        Sl    2020   0:00 bee run -vendor=true -downdoc=true -gendoc=true
blockch+  26435  0.0  0.0 202812  1120 ?        Sl    2020   0:01 bee run -vendor=true -downdoc=true -gendoc=true
blockch+  28320  0.0  0.0 201404   716 ?        Sl    2020   0:01 bee run -vendor=true -downdoc=true -gendoc=true
blockch+  30480  0.0  0.0 266940   900 ?        Sl    2020   0:01 bee run -vendor=true -downdoc=true -gendoc=true
blockch+  32563  0.0  0.0 266940   728 ?        Sl    2020   0:00 bee run -vendor=true -downdoc=true -gendoc=true
blockch+  34510  0.0  0.0 203068   616 ?        Sl    2020   0:01 bee run -vendor=true -downdoc=true -gendoc=true
blockch+  36687  0.0  0.0 202812   616 ?        Sl    2020   0:00 bee run -vendor=true -downdoc=true -gendoc=true
blockch+  88789  0.0  0.0 160456 10136 ?        Sl   13:52   0:00 bee run -vendor=true -downdoc=true -gendoc=true
blockch+  91428  0.0  0.0 267292  9516 ?        Sl   15:11   0:00 bee run -vendor=true -downdoc=true -gendoc=true
```

Actualmente hay:

```
root@prd-blockchain-0001:~# ps aux|grep bee|grep -v grep
blockch+   1986  0.0  0.0 268348 10336 ?        Sl   16:25   0:00 bee run -vendor=true -downdoc=true -gendoc=true

```

Se observa que sigue habiendo actividad en los puertos:
```
root@prd-blockchain-0001:~# tcpdump -i service-01 -s0 -A port 21000
tcpdump: verbose output suppressed, use -v or -vv for full protocol decode
listening on service-01, link-type EN10MB (Ethernet), capture size 262144 bytes
18:48:44.502201 IP ec2-54-72-163-31.eu-west-1.compute.amazonaws.com.60480 > prd-blockchain-0001.xunta.local.21000: Flags [S], seq 3658729332, win 29200, options [mss 1380,sackOK,TS val 1067773072 ecr 0,nop,wscale 7], length 0
E..<:.@. ...6H..
..y.@R....t......r.A......d...
?...........
18:48:44.502268 IP prd-blockchain-0001.xunta.local.21000 > ec2-54-72-163-31.eu-west-1.compute.amazonaws.com.60480: Flags [R.], seq 0, ack 3658729333, win 0, length 0
E..(..@.@..(
..y6H..R..@.......uP...Gi..


root@prd-blockchain-0001:~# tcpdump -i service-01 -s0 -A port 22000
tcpdump: verbose output suppressed, use -v or -vv for full protocol decode
listening on service-01, link-type EN10MB (Ethernet), capture size 262144 bytes
18:50:05.100238 IP tomcat7-pro.xunta.local.37463 > prd-blockchain-0001.xunta.local.22000: Flags [S], seq 4227264398, win 14600, options [mss 1460,sackOK,TS val 1551499806 ecr 0,nop,wscale 7], length 0
E..<..@.?.\.
.7W
..y.WU...........9..Y.........
\z..........
18:50:05.100342 IP prd-blockchain-0001.xunta.local.22000 > tomcat7-pro.xunta.local.37463: Flags [R.], seq 0, ack 4227264399, win 0, length 0
E..(.8@.@.a_
..y
.7WU..W........P.......
18:50:05.104183 IP tomcat7-pro.xunta.local.37464 > prd-blockchain-0001.xunta.local.22000: Flags [S], seq 3523650951, win 14600, options [mss 1460,sackOK,TS val 1551499815 ecr 0,nop,wscale 7], length 0
```

**Comment by alejandroalffer** [comment]
Hola! Prueba a añadir al linea de comando de arranque de geth este argumento:

```--cache 1024 ```

Por favor, testea  también el espacio en disco, con un "df -h", por ejemplo

**Comment by sistemasamtega** [comment]
Ya se estaba llamando con ese argumento de cache, como se puede ver con ps.
Hemos reducido el espacio de logs en unos GB, pero parece que hay espacio de sobra:

```
root@prd-blockchain-0001:~# df -h
Filesystem                   Size  Used Avail Use% Mounted on
udev                         7,9G     0  7,9G   0% /dev
tmpfs                        1,6G  9,0M  1,6G   1% /run
/dev/mapper/vg_00-lv_root     12G  5,0G  5,5G  48% /
tmpfs                        7,9G     0  7,9G   0% /dev/shm
tmpfs                        5,0M     0  5,0M   0% /run/lock
tmpfs                        7,9G     0  7,9G   0% /sys/fs/cgroup
/dev/sda1                    922M  110M  750M  13% /boot
/dev/mapper/vg_01-lv_data     99G   77G   18G  82% /data
/dev/mapper/vg_00-lv_home    4,5G  9,4M  4,3G   1% /home
/dev/mapper/vg_00-lv_tmp     1,8G  2,9M  1,7G   1% /tmp
/dev/mapper/vg_00-lv_varlog  9,1G   44M  8,6G   1% /var/log
tmpfs                        1,6G     0  1,6G   0% /run/user/1001


root@prd-blockchain-0001:~# du -h --max-depth=1 /data/
6,1M    /data/alastria-node.BACKUP
4,0K    /data/.cache
77G     /data/alastria
16K     /data/lost+found
6,2M    /data/alastria-node
77G     /data/
root@prd-blockchain-0001:~# du -h --max-depth=1 /data/alastria
59G     /data/alastria/data
18G     /data/alastria/logs
129M    /data/alastria/workspace
77G     /data/alastria
root@prd-blockchain-0001:~# du -h --max-depth=1 /data/alastria/data/
20K     /data/alastria/data/keystore
28K     /data/alastria/data/constellation
59G     /data/alastria/data/geth
59G     /data/alastria/data/
root@prd-blockchain-0001:~# du -h --max-depth=1 /data/alastria/data/geth
20K     /data/alastria/data/geth/lightchaindata
152K    /data/alastria/data/geth/nodes
59G     /data/alastria/data/geth/chaindata
59G     /data/alastria/data/geth


root@prd-blockchain-0001:/data/alastria/logs# df -h
Filesystem                   Size  Used Avail Use% Mounted on
udev                         7,9G     0  7,9G   0% /dev
tmpfs                        1,6G  9,0M  1,6G   1% /run
/dev/mapper/vg_00-lv_root     12G  5,0G  5,5G  48% /
tmpfs                        7,9G     0  7,9G   0% /dev/shm
tmpfs                        5,0M     0  5,0M   0% /run/lock
tmpfs                        7,9G     0  7,9G   0% /sys/fs/cgroup
/dev/sda1                    922M  110M  750M  13% /boot
/dev/mapper/vg_01-lv_data     99G   68G   26G  73% /data
/dev/mapper/vg_00-lv_home    4,5G  9,4M  4,3G   1% /home
/dev/mapper/vg_00-lv_tmp     1,8G  2,9M  1,7G   1% /tmp
/dev/mapper/vg_00-lv_varlog  9,1G  1,2G  7,5G  14% /var/log
tmpfs                        1,6G     0  1,6G   0% /run/user/1001

```

Tras lo cual he reiniciado de nuevo el servidor, pero lleva desde las 8:20 igual que en los casos anteriores.

Me había olvidado de comentar que ya nos surgió un problema similar el 29 de diciembre y se solucionó automáticamente el 31, tras varias ejecuciones del proceso geth, que lanzamos con cron cada minuto si detecta que no hay este proceso en ejecución. En este caso suposimos que el problema se debía a consultas demasiado grandes, ya que en los logs se observaban errores como 

```
INFO [12-29|17:54:23.064] Imported new chain segment               blocks=1931 txs=22  mgas=2.090   elapsed=8.127s    mgasps=0.257  number=57378771 hash=96ab15…2d49eb age=1w4d4h   cache=3.69mB
fatal error: runtime: out of memory

runtime stack:
runtime.throw(0x1152292, 0x16)
        /usr/local/go/src/runtime/panic.go:605 +0x95
runtime.sysMap(0xccbb010000, 0x10000000, 0x0, 0x1e91c18)
        /usr/local/go/src/runtime/mem_linux.go:216 +0x1d0
runtime.(*mheap).sysAlloc(0x1e78160, 0x10000000, 0x70029e189)
        /usr/local/go/src/runtime/malloc.go:470 +0xd7
runtime.(*mheap).grow(0x1e78160, 0x8000, 0x0)
        /usr/local/go/src/runtime/mheap.go:887 +0x60
runtime.(*mheap).allocSpanLocked(0x1e78160, 0x8000, 0x1e91c28, 0x7f2f48c1dea0)
        /usr/local/go/src/runtime/mheap.go:800 +0x334
runtime.(*mheap).alloc_m(0x1e78160, 0x8000, 0xc496700101, 0xc42023a780)
        /usr/local/go/src/runtime/mheap.go:666 +0x118
runtime.(*mheap).alloc.func1()
        /usr/local/go/src/runtime/mheap.go:733 +0x4d
runtime.systemstack(0x7f2f4affce10)
        /usr/local/go/src/runtime/asm_amd64.s:360 +0xab
runtime.(*mheap).alloc(0x1e78160, 0x8000, 0x7f2f4a010101, 0x42a224)
```

**Comment by alejandroalffer** [comment]
¿Sería posible arrancar geth sin puerto de aplicaciones?

Al menos hasta que sincronice la cadena, y comprobar que es geth es estable, antes de probar otras soluciones. Ya sabes... eliminar de la línea de argumentos aquellos que tengan que ver con el rcp, o bien hacer que escuche en un puerto diferente al tcp/22000: sólo temporalmente... dejar que sincronice la DLT sin aplicaciones, y vemos si es estable.

Creo que el problema puede venir por ahí: geth no se lleva bien con demasiadas trasacciones/conexiones concurrentes vía RCP (según mi experiencia, 3-4 simultáneas como mucho). Otros socios usan WebSockets y se obtiene mayor throughput, pero seguirá siendo un punto de fallo si no implementas un control... vía colas, o similar.

También vigila que tengas delante del RPC un firewall, dado que está abierto al 0.0.0.0

Seguimos comentando!

**Comment by sistemasamtega** [comment]
Lleva lanzado desde las 11:00 sin indicarle el puerto rpc.

```
root@prd-blockchain-0001:/data/alastria-node/scripts# ps aux|grep geth |grep -v grep
blockch+   7186  103  8.0 1880888 1325256 ?     Sl   11:00   0:42 geth --datadir /data/alastria/data --networkid 83584648538 --identity REG_AMTEGA_Telsius_4_8_00 --permissioned --rpcvhosts=prd-blockchain-0001.xunta.local --rpc --rpcaddr 0.0.0.0 --rpcapi admin,db,eth,debug,miner,net,shh,txpool,personal,web3,quorum,istanbul --port 21000 --cache 1024 --istanbul.requesttimeout 10000 --ethstats REG_AMTEGA_Telsius_4_8_00:bb98a0b6442386d0cdf8a31b267892c1@netstats.telsius.alastria.io:80 --verbosity 3 --vmdebug --emitcheckpoints --targetgaslimit 8000000 --syncmode full --gcmode full --vmodule consensus/istanbul/core/core.go=5 --nodiscover
```

Se ha permitido el tráfico tcp de 80 y 443 con iptables, pero se ven paquetes al hacer los tcpdump en ninguno de los puertos.
El log sigue sin pasar del setting new local account.

**Comment by alejandroalffer** [comment]
Hola! Qué devuelve la consola? Sigue dando el problema de memoria?

*Contáctame por Slack y revisamos juntos el nodo*

El puerto 80 y 443 se usan para acceder a RPC a través de un proxy ngnix (puedes ver el repositorio https://github.com/alastria/alastria-access-point) Se trata de una funcionalidad poco mantenida, pero interesante: permite filtrar la familia de aplicaciones que quieras que accedan a RPC/WS de Geth

**Comment by sistemasamtega** [comment]
Se contactó por Slack y se examinó la situación en detalle.
Tras estar ejecutando varios días el proceso geth de forma interrumpida se terminó sincronizando de nuevo el siguiente bloque tras 30h de ejecución del proceso de forma ininterrumpida. Si esto no hubiera funcionado seguramente habríamos tenido que reconstruír la base de datos (60GB).
Actualmente lleva 8 días ejecutándose de forma ininterrumpida, por lo que cerramos el issue.
